Nome do alimento,Fonte,Kcal,Proteina,Hidratos,Gordura
,,,,,
salsa fresca,INSA,"20,00 Kcal","3,10 g","0,40 g","0,00 g"
coentros crus,INSA,"28,00 Kcal","2,40 g","1,80 g","0,60 g"
alho cru,INSA,"72,00 Kcal","3,80 g","11,30 g","0,60 g"
alho em pó,INSA,"310,00 Kcal","17,60 g","52,30 g","1,20 g"
"peito de frango com pele, cru",INSA,"177,00 Kcal","24,10 g","0,00 g","8,90 g"
"peito de frango sem pele, cru",INSA,"108,00 Kcal","24,10 g","0,00 g","1,20 g"
"perna de frango sem pele, crua",INSA,"111,00 Kcal","22,00 g","0,00 g","2,60 g"
"frango, pele crua",INSA,"474,00 Kcal","9,70 g","0,00 g","48,30 g"
"frango (1/4), peito e asa com pele, crus",INSA,"196,00 Kcal","20,40 g","0,00 g","12,70 g"
"frango (1/4), perna com costa e pele, crua",INSA,"195,00 Kcal","19,10 g","0,00 g","13,00 g"
"frango inteiro com pele, cru",INSA,"201,00 Kcal","19,60 g","0,00 g","13,60 g"
"frango inteiro sem pele, cru",INSA,"110,00 Kcal","22,90 g","0,00 g","2,00 g"
pão ralado,INSA,"359,00 Kcal","11,20 g","71,60 g","2,30 g"
leite de cabra cru,INSA,"70,00 Kcal","3,80 g","4,60 g","4,00 g"
leite de ovelha cru,INSA,"93,00 Kcal","5,10 g","4,20 g","6,20 g"
"leite gordo, pasteurizado",INSA,"62,00 Kcal","3,00 g","4,70 g","3,50 g"
"leite gordo, uht",INSA,"62,00 Kcal","3,00 g","4,70 g","3,50 g"
"leite meio gordo, uht",INSA,"47,00 Kcal","3,30 g","4,90 g","1,60 g"
"leite magro, uht",INSA,"35,00 Kcal","3,40 g","4,90 g","0,20 g"
"leite meio gordo aromatizado, uht",INSA,"60,00 Kcal","3,00 g","7,90 g","1,80 g"
"leite gordo especial, pasteurizado",INSA,"62,00 Kcal","3,10 g","4,80 g","3,40 g"
"leite gordo, pó",INSA,"495,00 Kcal","26,80 g","38,70 g","25,90 g"
"leite meio gordo, pó",INSA,"427,00 Kcal","30,70 g","45,60 g","13,50 g"
"leite magro, pó",INSA,"359,00 Kcal","35,10 g","52,70 g","0,90 g"
leite condensado,INSA,"338,00 Kcal","7,80 g","56,40 g","9,00 g"
leite evaporado,INSA,"136,00 Kcal","6,60 g","9,80 g","7,80 g"
"leite humano, colostro",INSA,"60,00 Kcal","2,30 g","6,30 g","2,80 g"
"leite humano, transição",INSA,"66,00 Kcal","1,60 g","6,60 g","3,70 g"
leite humano,INSA,"66,00 Kcal","1,40 g","7,50 g","3,40 g"
queijo emmental,INSA,"384,00 Kcal","28,90 g","0,00 g","29,70 g"
queijo são jorge,INSA,"409,00 Kcal","26,60 g","2,50 g","32,50 g"
queijo fundido 40% gordura,INSA,"326,00 Kcal","22,50 g","0,20 g","25,70 g"
requeijão de vaca,INSA,"149,00 Kcal","8,00 g","5,80 g","10,40 g"
queijo de azeitão,INSA,"339,00 Kcal","19,50 g","2,60 g","27,50 g"
queijo camembert,INSA,"254,00 Kcal","19,20 g","0,20 g","19,60 g"
queijo de évora,INSA,"405,00 Kcal","23,80 g","2,10 g","32,90 g"
queijo parmesão,INSA,"406,00 Kcal","37,70 g","0,10 g","27,80 g"
queijo roquefort,INSA,"372,00 Kcal","22,00 g","0,20 g","31,50 g"
queijo serra da estrela,INSA,"324,00 Kcal","23,80 g","2,00 g","24,00 g"
"queijo serra da estrela, velho",INSA,"389,00 Kcal","25,50 g","0,20 g","31,50 g"
queijo serpa,INSA,"375,00 Kcal","22,00 g","2,40 g","30,50 g"
"queijo creme para barrar, alto teor polinsaturados",INSA,"263,00 Kcal","9,30 g","6,90 g","22,00 g"
queijo fresco açucarado com sabor a fruta,INSA,"110,00 Kcal","7,30 g","11,60 g","3,60 g"
queijo quark natural meio gordo,INSA,"125,00 Kcal","8,10 g","3,90 g","8,50 g"
queijo quark natural magro,INSA,"60,00 Kcal","10,30 g","4,00 g","0,30 g"
queijo quark açucarado magro com sabor a fruta,INSA,"78,00 Kcal","8,40 g","10,80 g","0,10 g"
nata maturada pasteurizada 30% gordura,INSA,"306,00 Kcal","1,90 g","2,70 g","32,00 g"
nata pasteurizada 36% gordura,INSA,"340,00 Kcal","2,00 g","1,90 g","36,00 g"
"nata pasteurizada para café, 15% gordura",INSA,"153,00 Kcal","2,00 g","2,40 g","15,00 g"
nata pasteurizada 33% gordura,INSA,"317,00 Kcal","2,00 g","2,90 g","33,00 g"
nata para bater pasteurizada 34% gordura,INSA,"323,00 Kcal","2,20 g","2,10 g","34,00 g"
nata uht 35% gordura,INSA,"335,00 Kcal","1,80 g","3,10 g","35,00 g"
"iogurte magro, natural, com edulcorantes",INSA,"47,00 Kcal","5,00 g","6,30 g","0,10 g"
"iogurte magro, com cereais e edulcorantes",INSA,"50,00 Kcal","4,30 g","5,70 g","0,40 g"
"iogurte meio gordo, natural, açucarado",INSA,"91,00 Kcal","4,70 g","13,10 g","2,10 g"
"iogurte líquido meio gordo, natural, açucarado",INSA,"70,00 Kcal","3,10 g","11,20 g","1,40 g"
"iogurte líquido meio gordo, aromatizado, açucarado",INSA,"70,00 Kcal","3,00 g","11,50 g","1,30 g"
"iogurte meio gordo, com polpa e/ou pedaços de fruta, açucarado",INSA,"92,00 Kcal","4,30 g","14,60 g","1,70 g"
"iogurte meio gordo, natural",INSA,"54,00 Kcal","4,20 g","5,00 g","1,80 g"
"iogurte líquido magro, aromatizado, açucarado",INSA,"62,00 Kcal","3,20 g","11,60 g","0,30 g"
"iogurte magro, aromatizado, açucarado",INSA,"69,00 Kcal","5,00 g","11,80 g","0,10 g"
"iogurte magro, natural",INSA,"42,00 Kcal","4,60 g","5,20 g","0,20 g"
"iogurte gordo, com polpa e/ou pedaços de fruta, açucarado",INSA,"96,00 Kcal","4,20 g","12,40 g","3,20 g"
"iogurte gordo, com polpa e/ou pedaços de fruta e cereais açucarado",INSA,"114,00 Kcal","4,20 g","15,80 g","3,20 g"
"iogurte gordo, aromatizado, açucarado",INSA,"83,00 Kcal","3,90 g","8,50 g","3,60 g"
"ovo de galinha inteiro, cru",INSA,"143,00 Kcal","12,60 g","0,50 g","10,10 g"
"gema de ovo de galinha, crua",INSA,"342,00 Kcal","16,00 g","0,00 g","30,90 g"
"clara de ovo de galinha, crua",INSA,"47,00 Kcal","11,00 g","0,00 g","0,30 g"
"ovo de galinha, cozido",INSA,"149,00 Kcal","13,00 g",,"10,80 g"
"ovo de galinha, escalfado",INSA,"150,00 Kcal","13,00 g","0,00 g","10,90 g"
"ovo de galinha, estrelado com manteiga",INSA,"194,00 Kcal","13,70 g","0,00 g","15,50 g"
"ovo de galinha, estrelado com margarina",INSA,"194,00 Kcal","13,70 g","0,00 g","15,50 g"
"ovo de galinha, estrelado com azeite",INSA,"191,00 Kcal","13,80 g","0,00 g","15,10 g"
"ovo de galinha, mexido com manteiga",INSA,"197,00 Kcal","13,00 g","0,00 g","16,10 g"
"ovo de galinha, mexido com margarina",INSA,"196,00 Kcal","13,00 g","0,00 g","16,00 g"
omelete com manteiga,INSA,"199,00 Kcal","13,00 g","0,00 g","16,30 g"
omelete com margarina,INSA,"198,00 Kcal","13,00 g","0,00 g","16,20 g"
"ovo de galinha líquido, pasteurizado",INSA,"131,00 Kcal","11,90 g","0,00 g","9,30 g"
"costeleta ou perna de borrego, crua",INSA,"124,00 Kcal","19,70 g","0,00 g","5,00 g"
"costeleta de carneiro, crua",INSA,"151,00 Kcal","20,80 g","0,00 g","7,50 g"
"pá de carneiro, crua",INSA,"195,00 Kcal","20,50 g","0,00 g","12,60 g"
"peito de carneiro gordo, cru",INSA,"396,00 Kcal","16,80 g","0,00 g","36,50 g"
"perna de carneiro gorda, crua",INSA,"276,00 Kcal","19,10 g","0,00 g","22,20 g"
"perna de carneiro magra, crua",INSA,"130,00 Kcal","19,80 g","0,00 g","5,60 g"
"costeleta ou perna de borrego, cozida",INSA,"157,00 Kcal","26,50 g","0,00 g","5,70 g"
"peito de carneiro gordo, cozido",INSA,"333,00 Kcal","23,30 g","0,00 g","26,60 g"
"pá de carneiro, cozida",INSA,"238,00 Kcal","27,60 g","0,00 g","14,20 g"
"costeleta ou perna de borrego, estufada sem molho",INSA,"185,00 Kcal","25,50 g","0,00 g","9,20 g"
"perna de carneiro gorda, estufada sem molho",INSA,"339,00 Kcal","26,50 g","0,00 g","25,90 g"
"pá de carneiro, estufada sem molho",INSA,"238,00 Kcal","27,60 g","0,00 g","14,20 g"
"perna de carneiro magra, estufada sem molho",INSA,"195,00 Kcal","25,60 g","0,00 g","10,30 g"
"perna de carneiro magra, estufada com margarina",INSA,"193,00 Kcal","17,40 g","1,70 g","12,50 g"
"perna de carneiro magra, estufada com azeite e margarina",INSA,"201,00 Kcal","17,40 g","1,70 g","13,40 g"
"costeleta ou perna de borrego, estufada com azeite e margarina",INSA,"183,00 Kcal","16,20 g","1,60 g","12,00 g"
"costeleta ou perna de borrego, estufada com margarina",INSA,"175,00 Kcal","16,20 g","1,60 g","11,10 g"
"costeleta ou perna de borrego, grelhada",INSA,"152,00 Kcal","25,70 g","0,00 g","5,50 g"
"perna de carneiro magra, assada, sem molho",INSA,"178,00 Kcal","24,20 g","0,00 g","9,00 g"
"perna de carneiro gorda, assada, sem molho",INSA,"285,00 Kcal","24,30 g","0,00 g","20,90 g"
"costeleta ou perna de borrego, assada, sem molho",INSA,"168,00 Kcal","24,10 g","0,00 g","8,00 g"
"pá de carneiro assada, sem molho",INSA,"202,00 Kcal","25,10 g","0,00 g","11,30 g"
"pá de carneiro, assada com margarina",INSA,"310,00 Kcal","24,30 g","0,00 g","23,60 g"
"pá de carneiro, assada com azeite e margarina",INSA,"319,00 Kcal","24,30 g","0,00 g","24,60 g"
perna de carneiro magra assada com margarina,INSA,"232,00 Kcal","23,50 g","0,00 g","15,30 g"
perna de carneiro magra assada com azeite e margarina,INSA,"242,00 Kcal","23,50 g","0,00 g","16,40 g"
costeleta ou perna de borrego assada com azeite e margarina,INSA,"234,00 Kcal","23,30 g","0,00 g","15,60 g"
costeleta ou perna de borrego assada com margarina,INSA,"224,00 Kcal","23,30 g","0,00 g","14,50 g"
"costeleta ou perna de borrego frita com margarina, sem molho",INSA,"166,00 Kcal","24,50 g","0,00 g","7,60 g"
"costeleta ou perna de carneiro magra frita com margarina, sem molho",INSA,"174,00 Kcal","24,70 g","0,00 g","8,40 g"
costeleta de cabrito crua,INSA,"120,00 Kcal","23,90 g","0,00 g","2,70 g"
peito de cabrito cru,INSA,"116,00 Kcal","20,50 g","0,00 g","3,80 g"
perna de cabrito crua,INSA,"113,00 Kcal","19,30 g","0,00 g","4,00 g"
"peito de cabrito estufado, sem molho",INSA,"153,00 Kcal","28,40 g","0,00 g","4,40 g"
peito de cabrito estufado com manteiga e óleo alimentar,INSA,"173,00 Kcal","23,30 g","0,80 g","8,40 g"
peito de cabrito estufado com margarina e óleo alimentar,INSA,"173,00 Kcal","23,30 g","0,80 g","8,40 g"
peito de cabrito estufado com azeite e margarina,INSA,"173,00 Kcal","23,30 g","0,80 g","8,40 g"
peito de cabrito estufado com azeite e óleo alimentar,INSA,"176,00 Kcal","23,30 g","0,70 g","8,80 g"
caldeirada de cabrito com azeite e banha,INSA,"119,00 Kcal","11,30 g","8,30 g","4,30 g"
caldeirada de cabrito com azeite e margarina,INSA,"116,00 Kcal","11,30 g","8,30 g","4,00 g"
costeleta de cabrito grelhada,INSA,"151,00 Kcal","30,90 g","0,00 g","3,00 g"
peito de cabrito grelhado,INSA,"144,00 Kcal","26,50 g","0,00 g","4,20 g"
perna de cabrito assada com óleo alimentar e margarina,INSA,"180,00 Kcal","21,70 g","0,20 g","10,00 g"
"perna de cabrito assada, sem molho",INSA,"135,00 Kcal","24,30 g","0,00 g","4,20 g"
perna de cabrito assada com azeite e margarina,INSA,"180,00 Kcal","21,70 g","0,20 g","10,00 g"
"bife de cavalo, alcatra crua",INSA,"116,00 Kcal","21,10 g","0,00 g","3,50 g"
lombo ou pá de cavalo cru,INSA,"99,00 Kcal","19,60 g","0,00 g","2,30 g"
"bife de cavalo, alcatra frita, sem molho",INSA,"147,00 Kcal","24,70 g","0,00 g","5,40 g"
"bife de cavalo, alcatra frita com manteiga",INSA,"177,00 Kcal","23,30 g","0,00 g","9,30 g"
"bife de cavalo, alcatra frita com margarina",INSA,"176,00 Kcal","23,30 g","0,00 g","9,20 g"
lombo ou pá de cavalo frito com manteiga,INSA,"158,00 Kcal","21,60 g","0,00 g","8,00 g"
lombo ou pá de cavalo frito com margarina,INSA,"157,00 Kcal","21,60 g","0,00 g","7,80 g"
"lombo ou pá de cavalo assado, sem molho",INSA,"136,00 Kcal","24,20 g","0,00 g","4,30 g"
lombo ou pá de cavalo assado com margarina,INSA,"161,00 Kcal","22,70 g","0,10 g","7,30 g"
lombo ou pá de cavalo assado com azeite e manteiga,INSA,"167,00 Kcal","22,70 g","0,10 g","8,00 g"
costeleta de porco gorda crua,INSA,"355,00 Kcal","17,30 g","0,00 g","31,80 g"
costeleta de porco meio gorda crua,INSA,"221,00 Kcal","19,80 g","0,00 g","15,80 g"
lombo de porco cru,INSA,"131,00 Kcal","22,20 g","0,00 g","4,70 g"
perna de porco gorda crua,INSA,"239,00 Kcal","18,10 g","0,00 g","18,50 g"
perna de porco magra crua,INSA,"152,00 Kcal","21,00 g","0,00 g","7,50 g"
entrecosto de porco cru,INSA,"190,00 Kcal","19,60 g","0,00 g","12,40 g"
entrecosto de porco cozido,INSA,"235,00 Kcal","26,90 g","0,00 g","14,20 g"
"costeleta de porco meio gorda estufada, sem molho",INSA,"284,00 Kcal","26,90 g","0,00 g","19,60 g"
"entrecosto de porco estufado, sem molho",INSA,"245,00 Kcal","26,60 g","0,00 g","15,40 g"
"perna de porco magra estufada, sem molho",INSA,"213,00 Kcal","28,60 g","0,00 g","11,00 g"
entrecosto de porco estufado com óleo alimentar e banha,INSA,"246,00 Kcal","20,90 g","0,70 g","17,10 g"
entrecosto de porco estufado com azeite e banha,INSA,"246,00 Kcal","20,90 g","0,70 g","17,10 g"
entrecosto de porco estufado com margarina,INSA,"239,00 Kcal","20,90 g","0,70 g","16,30 g"
entrecosto de porco estufado com azeite e margarina,INSA,"244,00 Kcal","20,90 g","0,70 g","16,80 g"
costeleta de porco meio gorda estufada com óleo alimentar e banha,INSA,"280,00 Kcal","21,10 g","0,70 g","20,70 g"
costeleta de porco meio gorda estufada com azeite e banha,INSA,"280,00 Kcal","21,10 g","0,70 g","20,70 g"
costeleta de porco meio gorda estufada com margarina,INSA,"272,00 Kcal","21,10 g","0,70 g","19,90 g"
costeleta de porco meio gorda estufada com azeite e margarina,INSA,"277,00 Kcal","21,10 g","0,70 g","20,40 g"
perna de porco magra estufada com azeite e margarina,INSA,"203,00 Kcal","22,40 g","0,70 g","11,60 g"
perna de porco magra estufada com azeite e banha,INSA,"206,00 Kcal","22,40 g","0,70 g","11,90 g"
perna de porco magra estufada com margarina,INSA,"198,00 Kcal","22,40 g","0,70 g","11,10 g"
perna de porco magra estufada com óleo alimentar e banha,INSA,"206,00 Kcal","22,40 g","0,70 g","11,90 g"
entrecosto de porco grelhado,INSA,"243,00 Kcal","26,80 g","0,00 g","15,10 g"
perna de porco magra grelhada,INSA,"215,00 Kcal","27,50 g","0,00 g","11,70 g"
perna de porco gorda grelhada,INSA,"287,00 Kcal","25,50 g","0,00 g","20,60 g"
lombo de porco grelhado,INSA,"189,00 Kcal","29,10 g","0,00 g","8,10 g"
costeleta de porco gorda grelhada,INSA,"305,00 Kcal","24,30 g","0,00 g","23,10 g"
costeleta de porco meio gorda grelhada,INSA,"261,00 Kcal","27,00 g","0,00 g","17,00 g"
"perna de porco magra assada, sem molho",INSA,"213,00 Kcal","31,00 g","0,00 g","9,90 g"
"lombo de porco assado, sem molho",INSA,"210,00 Kcal","32,70 g","0,00 g","8,80 g"
"perna de porco gorda assada, sem molho",INSA,"283,00 Kcal","27,60 g","0,00 g","19,20 g"
perna de porco gorda assada com azeite e margarina,INSA,"353,00 Kcal","22,40 g","0,20 g","28,20 g"
perna de porco gorda assada com óleo alimentar e margarina,INSA,"353,00 Kcal","22,40 g","0,20 g","28,20 g"
perna de porco gorda assada com margarina,INSA,"347,00 Kcal","22,40 g","0,20 g","27,60 g"
lombo de porco assado com margarina,INSA,"208,00 Kcal","28,20 g","0,00 g","10,60 g"
lombo de porco assado com óleo alimentar e margarina,INSA,"219,00 Kcal","27,50 g","0,20 g","11,10 g"
lombo de porco assado com azeite e margarina,INSA,"219,00 Kcal","27,50 g","0,20 g","11,10 g"
perna de porco magra assada com azeite e margarina,INSA,"245,00 Kcal","26,00 g","0,20 g","14,60 g"
perna de porco magra assada com óleo alimentar e margarina,INSA,"244,00 Kcal","26,00 g","0,20 g","14,50 g"
perna de porco magra assada com margarina,INSA,"239,00 Kcal","26,00 g","0,20 g","14,00 g"
costeleta de porco meio gorda frita panada,INSA,"341,00 Kcal","22,10 g","8,60 g","24,10 g"
lombo de porco frito panado,INSA,"249,00 Kcal","25,30 g","8,50 g","12,50 g"
lombo de porco frito com manteiga,INSA,"180,00 Kcal","28,80 g","0,00 g","7,20 g"
lombo de porco frito com margarina,INSA,"184,00 Kcal","28,80 g","0,00 g","7,60 g"
lombo de vaca magro cru,INSA,"114,00 Kcal","21,00 g","0,00 g","3,30 g"
vaca para assar crua,INSA,"174,00 Kcal","19,40 g","0,00 g","10,70 g"
vaca para cozer ou estufar magra crua,INSA,"175,00 Kcal","21,70 g","0,00 g","9,80 g"
vaca para cozer ou estufar meio gorda crua,INSA,"227,00 Kcal","21,30 g","0,00 g","15,80 g"
vaca magra cozida,INSA,"259,00 Kcal","33,70 g","0,00 g","13,80 g"
"vaca magra estufada, sem molho",INSA,"234,00 Kcal","31,50 g","0,00 g","12,00 g"
"vaca meio gorda estufada, sem molho",INSA,"280,00 Kcal","31,80 g","0,00 g","17,00 g"
vaca meio gorda estufada com azeite e margarina,INSA,"278,00 Kcal","21,40 g","1,20 g","20,20 g"
vaca meio gorda estufada com óleo alimentar e margarina,INSA,"278,00 Kcal","21,40 g","1,20 g","20,20 g"
vaca meio gorda estufada com margarina,INSA,"273,00 Kcal","21,40 g","1,20 g","19,60 g"
vaca magra estufada com óleo alimentar e margarina,INSA,"226,00 Kcal","21,80 g","1,20 g","14,20 g"
vaca magra estufada com azeite e margarina,INSA,"226,00 Kcal","21,80 g","1,20 g","14,20 g"
vaca magra estufada com margarina,INSA,"220,00 Kcal","21,80 g","1,20 g","13,60 g"
"lombo de vaca magro assado, sem molho",INSA,"172,00 Kcal","29,20 g","0,00 g","6,10 g"
"vaca assada, sem molho",INSA,"192,00 Kcal","26,90 g","0,00 g","9,40 g"
lombo de vaca magro assado com margarina,INSA,"198,00 Kcal","26,20 g","0,00 g","10,40 g"
lombo de vaca magro assado com azeite e margarina,INSA,"205,00 Kcal","26,20 g","0,00 g","11,10 g"
lombo de vaca magro assado com óleo alimentar e margarina,INSA,"205,00 Kcal","26,20 g","0,00 g","11,10 g"
"lombo de vaca magro assado com azeite, manteiga e óleo alimentar",INSA,"207,00 Kcal","26,20 g","0,00 g","11,40 g"
vaca assada com margarina,INSA,"273,00 Kcal","24,20 g","0,00 g","19,60 g"
vaca assada com azeite e margarina,INSA,"280,00 Kcal","24,20 g","0,00 g","20,40 g"
vaca assada com óleo alimentar e margarina,INSA,"280,00 Kcal","24,20 g","0,00 g","20,40 g"
"bife de vaca (valor médio de acém, alcatra e lombo) cru",INSA,"122,00 Kcal","20,90 g","0,00 g","4,30 g"
"bife de vaca (valor médio de acém, alcatra e lombo) grelhado",INSA,"163,00 Kcal","26,40 g","0,00 g","6,40 g"
"bife de vaca (valor médio de acém, alcatra e lombo) frito com manteiga",INSA,"201,00 Kcal","24,20 g","0,10 g","11,50 g"
"bife de vaca (valor médio de acém, alcatra e lombo) frito, sem molho",INSA,"183,00 Kcal","28,80 g","0,00 g","7,50 g"
vaca magra estufada à jardineira,INSA,"111,00 Kcal","5,50 g","11,40 g","4,40 g"
lombo de vitela cru,INSA,"148,00 Kcal","19,90 g","0,00 g","7,60 g"
costeleta de vitela crua,INSA,"121,00 Kcal","20,00 g","0,00 g","4,50 g"
peito de vitela magro cru,INSA,"147,00 Kcal","19,60 g","0,00 g","7,60 g"
peito de vitela magro cozido,INSA,"171,00 Kcal","24,80 g","0,00 g","8,00 g"
"peito de vitela magro estufado, sem molho",INSA,"179,00 Kcal","26,00 g","0,00 g","8,30 g"
peito de vitela magro estufado com margarina e óleo alimentar,INSA,"208,00 Kcal","22,90 g","0,60 g","12,60 g"
peito de vitela magro estufado com azeite e margarina,INSA,"208,00 Kcal","22,90 g","0,60 g","12,60 g"
"peito de vitela magro estufado com azeite, margarina e óleo alimentar",INSA,"208,00 Kcal","22,90 g","0,60 g","12,60 g"
lombo de vitela assado com azeite e margarina,INSA,"225,00 Kcal","23,00 g","0,20 g","14,40 g"
lombo de vitela assado com margarina e óleo alimentar,INSA,"225,00 Kcal","23,00 g","0,20 g","14,40 g"
"lombo de vitela assado com azeite, margarina e óleo alimentar",INSA,"225,00 Kcal","23,00 g","0,20 g","14,40 g"
"lombo de vitela assado, sem molho",INSA,"151,00 Kcal","25,10 g","0,00 g","5,60 g"
lombo de vitela grelhado,INSA,"150,00 Kcal","25,00 g","0,00 g","5,60 g"
costeleta de vitela grelhada,INSA,"131,00 Kcal","25,20 g","0,00 g","3,30 g"
lombo de vitela frito com margarina,INSA,"217,00 Kcal","23,50 g","0,00 g","13,70 g"
"lombo de vitela frito, sem molho",INSA,"195,00 Kcal","24,90 g","0,00 g","10,60 g"
costeleta de vitela frita com margarina,INSA,"183,00 Kcal","23,40 g","0,00 g","9,90 g"
"costeleta de vitela frita, sem molho",INSA,"159,00 Kcal","24,30 g","0,00 g","6,90 g"
"frango inteiro com pele, cozido",INSA,"204,00 Kcal","26,10 g","0,00 g","11,10 g"
"frango inteiro com pele, estufado com margarina",INSA,"221,00 Kcal","19,10 g","1,80 g","15,10 g"
"frango inteiro com pele, estufado com azeite e margarina",INSA,"224,00 Kcal","19,10 g","1,80 g","15,40 g"
"frango inteiro com pele, estufado sem molho",INSA,"233,00 Kcal","28,80 g","0,00 g","13,10 g"
"frango inteiro com pele, grelhado",INSA,"239,00 Kcal","27,60 g","0,00 g","14,30 g"
"frango inteiro com pele, assado sem molho",INSA,"239,00 Kcal","27,60 g","0,00 g","14,30 g"
"frango inteiro sem pele, cozido",INSA,"169,00 Kcal","32,80 g","0,00 g","4,20 g"
"frango inteiro sem pele, estufado com margarina",INSA,"126,00 Kcal","21,00 g","1,70 g","3,80 g"
"frango inteiro sem pele, estufado com azeite e margarina",INSA,"129,00 Kcal","21,00 g","1,70 g","4,10 g"
"frango inteiro sem pele, estufado sem molho",INSA,"185,00 Kcal","33,20 g","0,00 g","5,80 g"
"frango inteiro sem pele, grelhado",INSA,"168,00 Kcal","31,00 g","0,00 g","4,90 g"
"frango (1/4) peito e asa com pele, cozidos",INSA,"202,00 Kcal","27,20 g","0,00 g","10,30 g"
"frango (1/4) peito e asa com pele, estufados com margarina",INSA,"201,00 Kcal","18,50 g","1,70 g","13,20 g"
"frango (1/4) peito e asa com pele, estufados com azeite e margarina",INSA,"204,00 Kcal","18,50 g","1,70 g","13,50 g"
"frango (1/4) peito e asa com pele, estufados sem molho",INSA,"223,00 Kcal","29,20 g","0,00 g","11,80 g"
"frango (1/4) peito e asa com pele, grelhados",INSA,"235,00 Kcal","28,70 g","0,00 g","13,40 g"
"frango (1/4) perna com costa e pele, cozida",INSA,"197,00 Kcal","25,50 g","0,00 g","10,60 g"
"frango (1/4) perna com costa e pele, estufada com azeite e margarina",INSA,"203,00 Kcal","17,30 g","1,70 g","13,80 g"
"frango (1/4) perna com costa e pele, estufada com margarina",INSA,"200,00 Kcal","17,30 g","1,70 g","13,50 g"
"frango (1/4) perna com costa e pele, estufada sem molho",INSA,"215,00 Kcal","26,90 g","0,00 g","11,90 g"
"frango (1/4), perna com costa e pele, grelhada",INSA,"231,00 Kcal","26,90 g","0,00 g","13,70 g"
"frango (1/4) perna com costa e pele, assada sem molho",INSA,"231,00 Kcal","26,90 g","0,00 g","13,70 g"
"perna de frango sem pele, cozida",INSA,"147,00 Kcal","31,50 g","0,00 g","2,30 g"
"perna de frango sem pele, estufada com margarina",INSA,"121,00 Kcal","19,10 g","1,60 g","4,10 g"
"perna de frango sem pele, estufada com azeite e margarina",INSA,"124,00 Kcal","19,10 g","1,60 g","4,40 g"
"perna de frango sem pele, estufada sem molho",INSA,"180,00 Kcal","32,90 g","0,00 g","5,40 g"
"peito de frango com pele, cozido",INSA,"194,00 Kcal","32,10 g","0,00 g","7,30 g"
"peito de frango com pele, estufado com margarina",INSA,"187,00 Kcal","22,10 g","1,70 g","10,00 g"
"peito de frango com pele, estufado com azeite e margarina",INSA,"189,00 Kcal","22,10 g","1,70 g","10,30 g"
"peito de frango com pele, estufado sem molho",INSA,"212,00 Kcal","34,40 g","0,00 g","8,30 g"
"peito de frango sem pele, cozido",INSA,"148,00 Kcal","34,50 g","0,00 g","1,10 g"
"peito de frango sem pele, estufado com margarina",INSA,"121,00 Kcal","21,40 g","1,70 g","3,00 g"
"peito de frango sem pele, estufado com azeite e margarina",INSA,"124,00 Kcal","21,40 g","1,70 g","3,30 g"
"peito de frango sem pele, estufado sem molho",INSA,"169,00 Kcal","36,60 g","0,00 g","2,50 g"
coelho cru,INSA,"117,00 Kcal","20,30 g","0,00 g","4,00 g"
coelho estufado com margarina,INSA,"205,00 Kcal","26,60 g","0,90 g","9,50 g"
coelho estufado com azeite,INSA,"218,00 Kcal","26,60 g","0,90 g","11,00 g"
"pato com pele, cru",INSA,"394,00 Kcal","12,30 g","0,00 g","38,30 g"
"pato sem pele, cru",INSA,"133,00 Kcal","19,30 g","0,00 g","6,20 g"
"pato sem pele, estufado com margarina",INSA,"232,00 Kcal","27,20 g","0,00 g","13,70 g"
"pato com pele, assado sem molho",INSA,"347,00 Kcal","18,50 g","0,00 g","30,30 g"
"pato sem pele, assado com margarina",INSA,"276,00 Kcal","36,20 g","0,00 g","14,60 g"
"peito de peru com pele, cru",INSA,"134,00 Kcal","23,00 g","0,00 g","4,70 g"
"perna de peru com pele, crua",INSA,"149,00 Kcal","18,90 g","0,00 g","8,10 g"
"peito de peru sem pele, cru",INSA,"105,00 Kcal","23,40 g","0,00 g","1,30 g"
"peru inteiro com pele, cru",INSA,"137,00 Kcal","20,50 g","0,00 g","6,10 g"
"perna de peru com pele, estufada com margarina",INSA,"170,00 Kcal","19,10 g","1,30 g","9,70 g"
"peito de peru com pele, estufado com margarina",INSA,"163,00 Kcal","23,10 g","1,30 g","7,10 g"
"peito de peru sem pele, assado com margarina",INSA,"175,00 Kcal","28,90 g","0,10 g","6,40 g"
"perna de peru com pele, assada com margarina",INSA,"212,00 Kcal","24,40 g","0,00 g","12,50 g"
"peito de peru sem pele, panado",INSA,"226,00 Kcal","25,50 g","8,40 g","9,90 g"
hambúrguer de feijão manteiga frito com azeite,INSA,"169,00 Kcal","8,00 g","19,80 g","5,30 g"
hambúrguer de feijão manteiga frito com óleo de milho,INSA,"169,00 Kcal","8,00 g","19,80 g","5,30 g"
"hambúrguer de vaca, cru",INSA,"142,00 Kcal","20,20 g","0,00 g","6,80 g"
"hambúrguer de vaca, grelhado",INSA,"183,00 Kcal","27,30 g","0,00 g","8,20 g"
"hambúrguer de porco, frito, sem molho",INSA,"264,00 Kcal","27,50 g","0,00 g","17,10 g"
"hambúrguer de porco, grelhado",INSA,"261,00 Kcal","27,80 g","0,00 g","16,60 g"
cubo de carne de vaca para caldo,INSA,"183,00 Kcal","19,80 g","8,00 g","8,00 g"
cubo de carne de galinha para caldo,INSA,"236,00 Kcal","15,40 g","9,00 g","15,40 g"
caldo preparado com cubo de carne de vaca (diluição 2%),INSA,"4,00 Kcal","0,40 g","0,20 g","0,20 g"
caldo preparado com cubo de carne de galinha (diluição 2%),INSA,"5,00 Kcal","0,30 g","0,20 g","0,30 g"
"codorniz com pele, crua",INSA,"170,00 Kcal","21,50 g","0,00 g","9,30 g"
"codorniz carne sem pele, crua",INSA,"119,00 Kcal","22,10 g","0,00 g","3,40 g"
"codorniz com pele, estufada com azeite",INSA,"234,00 Kcal","25,60 g","0,70 g","13,40 g"
"codorniz com pele, grelhada",INSA,"202,00 Kcal","24,50 g","0,00 g","11,60 g"
perdiz crua,INSA,"104,00 Kcal","23,00 g","0,00 g","1,30 g"
perdiz estufada com margarina,INSA,"212,00 Kcal","24,70 g","0,70 g","11,40 g"
"toucinho de porco entremeado fresco, cru",INSA,"682,00 Kcal","8,40 g","0,00 g","72,00 g"
"toucinho de porco entremeado ligeiramente salgado, cru",INSA,"506,00 Kcal","13,70 g","0,00 g","50,10 g"
"toucinho de porco entremeado ligeiramente salgado, cozido sem adição de sal",INSA,"372,00 Kcal","16,70 g","0,00 g","33,90 g"
"toucinho de porco entremeado fresco, grelhado sem adição de sal",INSA,"676,00 Kcal","16,10 g","0,00 g","67,90 g"
bacon,INSA,"367,00 Kcal","13,80 g","0,00 g","34,60 g"
"bacon, grelhado sem adição de sal",INSA,"372,00 Kcal","22,20 g","0,00 g","31,50 g"
banha de porco,INSA,"896,00 Kcal","0,00 g","0,00 g","99,50 g"
vinagre,INSA,"22,00 Kcal","0,30 g","0,60 g","0,00 g"
"coração de porco, cru",INSA,"113,00 Kcal","18,40 g","0,00 g","4,40 g"
"coração de porco, estufado com banha e margarina",INSA,"193,00 Kcal","20,90 g","1,00 g","10,50 g"
